url,title,company,location,description
https://ph.linkedin.com/jobs/view/xtn-45bb681-frontend-developer-at-kmc-careers-4292658482?position=52&pageNum=0&refId=S1bO8FLeUJZ07I1rrjG92A%3D%3D&trackingId=Ek0XMESFPcmOwEN1gHnldw%3D%3D,XTN-45BB681 | FRONTEND DEVELOPER,KMC Careers,Taguig,"We at Orchard are currently on the lookout for a talented Front-end Developer with awesome JavaScript, HTML & CSS skills to work in our development team. Your key functions will range from assisting in project implementations, translating wireframes to production level HTML/CSS/JS, and working on third-party platforms for a range of clients.

The employee shall be eligible to receive a maximum of twenty (20) accrued leave credits per calendar year which may be used for SL and VL with an accrual rate of 1.67 leaves per month upon commencement of employment.

The employee shall be eligible for an HMO plan upon hire with coverage of Php 300,000 per illness per year.

The employee shall be eligible to enroll one (1) free dependent upon hire with the coverage of Php300,000 per illness per year. HMO eligibility and hierarchy of dependent shall be subject to the guidelines and standards of the HMO provider.

The employee shall be eligible of up to Php1,000,000 coverage under a Group Life Insurance policy upon hire. Claims shall be subject to the general guidelines and required documentation set by the service provider. Failure to comply may result in the forfeiture of any claims. Exclusions and exemptions from claiming this benefit are defined under the exclusion sections of the general guidelines of the GLI policy.

The employee shall be entitled to additional one (1) paid time-off annually on top of the accrued leave credits.

The employee shall be eligible for a monthly reimbursable internet allowance of up to Php2,000.00, provided that the employee must submit official receipts and supporting documents to account for the expenses.

With a minimum rendered work of at least one (1) month during the calendar year, the employee shall be entitled to a 13th Month Pay equivalent to 1/12 of the employee’s gross monthly salary multiplied by the number of months worked or earned within a given calendar year to be released on or before Dec 24 of every calendar year, subject to the computation as provided by the Labor Code and other pertinent issuances of the Department of Labor and Employment."
https://ph.linkedin.com/jobs/view/software-developer-python-or-javascript-at-globant-4291570881?position=53&pageNum=0&refId=S1bO8FLeUJZ07I1rrjG92A%3D%3D&trackingId=fnkNYMj7zM1qi9qf3wuUpA%3D%3D,Software Developer (Python or JavaScript),Globant,Manila,"At Globant, we are working to make the world a better place, one step at a time. We enhance business development and enterprise solutions to prepare them for a digital future. With a diverse and talented team present in more than 30 countries, we are strategic partners to leading global companies in their business process transformation.

We seek a who shares our passion for innovation and change. This role is critical to helping our business partners evolve and adapt to consumers' personalized expectations in this new technological era.











This job can be filled in or .

Create with us digital products that people love. We will bring businesses and consumers together through AI technology and creativity, driving digital transformation to impact the world positively.

Globant is an Equal Opportunity employer. All qualified applicants will receive consideration for employment without regard to race, color, religion, sex, national origin, disability, veteran status, or any other characteristic protected by applicable federal, state, or local law. Globant is also committed to providing reasonable accommodations for qualified individuals with disabilities in our job application procedures. If you need assistance or an accommodation due to a disability, please let your recruiter know.

Final compensation offered is based on multiple factors such as the specific role, hiring location, as well as individual skills, experience, and qualifications. In addition to competitive salaries, we offer a comprehensive benefits package. Learn more about life at Globant here: Globant Experience Guide."
https://ph.linkedin.com/jobs/view/web-developer-next-js-at-jollibee-group-4307225737?position=54&pageNum=0&refId=S1bO8FLeUJZ07I1rrjG92A%3D%3D&trackingId=pXkUT0PAT8ahuAAAf30W8Q%3D%3D,Web Developer (Next.js),Jollibee Group,Pasig,"Title: Web Developer (Next.js)

The Web Developer (Next.js) will play a key role in developing and maintaining customer-facing web applications using Next.js. This position requires a strong technical foundation in modern JavaScript frameworks, particularly Next.js and React, and a commitment to following industry best practices. The developer will work closely with the Web Developer Team Lead ensuring high-quality code and optimal application performance in a hybrid work environment.



Feature Development & Implementation



Code Quality & Compliance



Performance Optimization



Agile Collaboration & Communication"
https://ph.linkedin.com/jobs/view/frontend-engineer-digital-venture-fully-remote-at-makro-pro-4288732689?position=55&pageNum=0&refId=S1bO8FLeUJZ07I1rrjG92A%3D%3D&trackingId=i94aCdIVtnjdwbKV19YXWg%3D%3D,"Frontend Engineer, Digital Venture - Fully REMOTE",Makro PRO,Philippines,"Makro PRO is an exciting new digital venture by the iconic Makro. Our proud purpose is to build a technology platform that will help make business possible for restaurant owners, hotels, and independent retailers, and open the door for sellers. Makro PRO brings together the to transform the B2B marketplace ecosystem. We welcome people who share our belief in collaboration, diversity, excellence, and putting customers at the heart of our work

. Join our team and help us build .



The Frontend Engineer is responsible for transforming the design and the product vision into working products and will directly influence how users will interact with the system. The Frontend Engineer works hard to stay on top of fast-changing technology and invests a lot of energy in learning new tricks. They are not only caught up on industry trends in client development frameworks but also know what the near future will bring. A love for clean interfaces and a passion for great user experiences goes without saying"
https://ph.linkedin.com/jobs/view/frontend-developer-react-at-perform-4300318866?position=56&pageNum=0&refId=S1bO8FLeUJZ07I1rrjG92A%3D%3D&trackingId=lQdZiknncqOT5N%2BkRKxiIw%3D%3D,Frontend Developer (React),Perform,Philippines,"We are seeking an experienced Frontend Developer (React) to design, develop, and maintain large-scale single-page web applications. You will collaborate with cross-functional teams in an Agile or Scaled Agile environment, leveraging your expertise in React.js, TypeScript, and complex state management to deliver high-quality software solutions.









Since 2005, Perform's engineers have been helping companies scale their apps and their teams. We were near-shoring before it was even a term and have worked with 100s of clients along the way."
https://ph.linkedin.com/jobs/view/full-stack-web-developer-at-questronix-corporation-4309822093?position=57&pageNum=0&refId=S1bO8FLeUJZ07I1rrjG92A%3D%3D&trackingId=CNEO3q%2BBW2AkTJEw97cG3Q%3D%3D,Full Stack Web Developer,Questronix Corporation,Mandaluyong,"Job Description

Design and develop web applications using React.




Minimum Qualifications:"
https://ph.linkedin.com/jobs/view/software-engineer-frontend-at-applause-4294884712?position=58&pageNum=0&refId=S1bO8FLeUJZ07I1rrjG92A%3D%3D&trackingId=BnSVh3GIYZ61CjdcLtNq%2BQ%3D%3D,Software Engineer (Frontend),Applause,Philippines,"About Applause

Applause is a SaaS start-up founded by experienced entrepreneurs and backed by the best VCs in Silicon Slopes. We're focused on helping companies supercharge their team's performance so they can win more lifelong customers. Learn more about our company and culture here: https://applausehq.com/aboutus

: The purpose of this role is to work directly with our lead developer/co-founder to implement frontend features and functionality. This developer will excel at taking clear requirements and directions, then translating them into high-quality, well-tested code that follows established conventions and patterns. Success in this role means consistently delivering features that work correctly the first time and integrate seamlessly with our existing systems.



The Software Engineer (FE) will work closely with our lead developer/co-founder, implementing frontend features based on clear specifications and requirements. This role is perfect for a detail-oriented developer who thrives on following established patterns and producing reliable, well-tested code.













100% remote with no office mandate | Earned PTO | 22 official company holidays | HMO on Day 1 | Amazing colleagues | Energetic culture that is positive and celebrates together | Inspiring mission & software product | Ability to grow your career by being early in a fast-growing tech startup | Ability to ship a lot of new features and make a real impact"
https://ph.linkedin.com/jobs/view/web-developer-at-everise-4314087955?position=59&pageNum=0&refId=S1bO8FLeUJZ07I1rrjG92A%3D%3D&trackingId=watp262kOQaghaXEp5WbAg%3D%3D,Web Developer,Everise,Manila,
https://ph.linkedin.com/jobs/view/react-js-developer-trade-fx-domin-at-unison-group-4313202335?position=60&pageNum=0&refId=S1bO8FLeUJZ07I1rrjG92A%3D%3D&trackingId=rAvLrCmL0cDgXx98jTMzdw%3D%3D,React JS Developer (Trade/FX Domin),Unison Group,Manila,Job Description : The client wants a hands-on front-end developer to build and enhance web UI modules for their in-house FX e-commerce platform. The focus is on ReactJS-based development with seamless collaboration with backend developers and business stakeholders.
https://ph.linkedin.com/jobs/view/junior-front-end-developer-at-media-meter-inc-4088317248?position=1&pageNum=0&refId=yD2KGBXSvf8NrDXQIVZzYg%3D%3D&trackingId=mpPH6oZXtVI9QNw1VBHAjw%3D%3D,Junior Front End Developer,Media Meter Inc.,Quezon City,"At Talisik Labs, our focus lies on crafting tools powered by generative AI. In the past year alone, we've developed a suite of groundbreaking AI applications, exemplified by the Unified Salina App . This suite encompasses a chat-with-video app, a chat-with-PDF app, and an AI assistant with memory capabilities. You'll be a key player in building and refining web applications like the V4 application. The V4 application, comprising Media Watch, Shared View, and Ad Watch, operates in harmony to deliver comprehensive media monitoring and analytics solutions, making a global impact.

As we expand into the global market, we're seeking a passionate individual with a strong background in frontend technologies, a knack for problem-solving, and the ability to thrive in a collaborative environment."
https://ph.linkedin.com/jobs/view/junior-front-end-web-developer-at-media-meter-inc-4169020706?position=2&pageNum=0&refId=yD2KGBXSvf8NrDXQIVZzYg%3D%3D&trackingId=KzLQmQ1YvFnGN06zhKLcBg%3D%3D,Junior Front End Web Developer,Media Meter Inc.,Quezon City,"We are seeking a talented Junior Front End Web Developer with experience in WordPress and mobile app development to join our dynamic team. In this role, you will contribute to both web and mobile projects, working closely with senior developers to create responsive, user-friendly applications."
https://ph.linkedin.com/jobs/view/front-end-developer-at-media-meter-inc-4109060680?position=3&pageNum=0&refId=yD2KGBXSvf8NrDXQIVZzYg%3D%3D&trackingId=LiuSR5jduJXPZr70XASkYw%3D%3D,Front End Developer,Media Meter Inc.,Quezon City,"At Talisik Labs, our focus lies on crafting tools powered by generative AI. In the past year alone, we've developed a suite of groundbreaking AI applications, exemplified by the Unified Salina App . This suite encompasses a chat-with-video app, a chat-with-PDF app, and an AI assistant with memory capabilities. You'll be a key player in building and refining web applications like the V4 application. The V4 application, comprising Media Watch, Shared View, and Ad Watch, operates in harmony to deliver comprehensive media monitoring and analytics solutions, making a global impact.

As we expand into the global market, we're seeking a passionate Front End Developer with a strong background in frontend technologies, a knack for problem-solving, and the ability to thrive in a collaborative environment."
https://ph.linkedin.com/jobs/view/frontend-developer-at-make-technology-inc-4095500416?position=4&pageNum=0&refId=yD2KGBXSvf8NrDXQIVZzYg%3D%3D&trackingId=WVVg2LHkyPYe6wASNLaqig%3D%3D,Frontend Developer,Make Technology Inc.,Makati,"LET’S WORK TOGETHER!

We’re looking for a Front-End Web Developer who is experienced in converting web designs into functional websites. Responsibilities will include, but not limited to, translation of the UI/UX design wireframes to actual code that will produce visual elements of the application. You will work closely with our awesome UI/UX designers and bridge the gap between graphical design and technical implementation."
https://ph.linkedin.com/jobs/view/front-end-developer-at-hungry-workhorse-4312062034?position=5&pageNum=0&refId=yD2KGBXSvf8NrDXQIVZzYg%3D%3D&trackingId=MIJT1q4kRI2rRtKW3iMifw%3D%3D,Front-end Developer,Hungry Workhorse,Muntinlupa City,"Services
About Us
Careers


Front-end Developer

Back to Careers

Role Overview



We are seeking a skilled and creative Front-end Developer to help build intuitive, responsive, and visually engaging user interfaces. In this role, you will work closely with cross-functional teams to transform ideas into seamless digital experiences, with a strong focus on performance, accessibility, and cross-platform compatibility.



Design, develop, and maintain user interfaces that are visually appealing, intuitive, and responsive.

Build reusable components and front-end libraries for future use.

Ensure high performance, high quality, and scalability of UI applications.

Collaborate with backend developers to integrate RESTful APIs and ensure seamless data flows.

Continuously stay up to date with the latest front-end technologies and industry trends to maintain best practices.

Debug and troubleshoot UI issues, ensuring a smooth user experience across browsers and devices.

Work closely with UX/UI designers to translate wireframes and designs into high-quality code.

Optimize components for maximum performance across a vast array of web-capable devices and browsers.

Participate in code reviews to maintain high code quality standards.



3+ years of experience in front-end development using React.js, Vue.js, and JavaScript.

Strong proficiency in HTML5, CSS3, and modern front-end build pipelines and tools such as Webpack, Babel, etc.

Experience with Node.js and integrating front-end code with RESTful services.

Solid understanding of cross-browser compatibility issues and ways to work around them.

Experience with state management libraries like Redux or Vuex.

Proficient understanding of code versioning tools such as Git.

Knowledge of UI/UX best practices and the ability to collaborate with designers to implement their vision.

Familiarity with responsive design principles and frameworks like Bootstrap or Tailwind CSS.

Exposure to Continuous Integration/Delivery pipelines (Jenkins, Docker, etc.).

Knowledge of testing frameworks such as Jest, Mocha, or Cypress is a plus.



Bachelor’s degree in Computer Science or equivalent experience.

Proficient in JavaScript, React.js, Vue.js, and Node.js.

Strong understanding of CSS frameworks and preprocessors like SASS or LESS.

Concrete examples of successful web applications or UI components built.

A mix of technical and communication skills to collaborate effectively with cross-functional teams.



Use this space to promote the business, its products or its services. Help people become familiar with the business and its offerings, creating a sense of connection and trust. Focus on what makes the business unique and how users can benefit from choosing it.

Join Us

First Name*

Last Name*

Phone*

Email Address*

Position*

Why do you want to work at Hungry Workhorse?*

LinkedIn Profile

GitHub Profile (If Applicable)

Please send your cv at info@hungryworkhorse.com

Hungry Workhorse is a Philippine-based digital and business transformation company that helps organizations adapt to the evolving digital economy.

Quick Links

Services



Articles

Careers

Privacy Policy

Contact

info@hungryworkhorse.com

Commercenter Alabang, Muntinlupa City, Philippines

© 2025 Hungry Workhorse Consultancy Inc."
https://ph.linkedin.com/jobs/view/frontend-developer-at-webcast-technologies-inc-4298292332?position=6&pageNum=0&refId=yD2KGBXSvf8NrDXQIVZzYg%3D%3D&trackingId=5qSgdw5l%2BCFIO%2B2b73rF1A%3D%3D,Frontend Developer,Webcast Technologies Inc.,Quezon City,"Write software codes - code new features and enhance existing software and website products of the company.
Document software/website development and enhancements."
https://ph.linkedin.com/jobs/view/front-end-developer-at-lightweight-solutions-4160100108?position=7&pageNum=0&refId=yD2KGBXSvf8NrDXQIVZzYg%3D%3D&trackingId=5I7LNyMtHY9QpU7ML558%2Bg%3D%3D,Front End Developer,Lightweight Solutions,Quezon City,"Description

Is coding your passion? Do you want to build innovations that can change the world?

If you’re a Front-End Developer, then Lightweight Solutions is looking for you!

Front-End Developers are the architects of software development! If coding is your passion and you’re looking to join a team where you create world-changing innovations, then come join us!

Key Responsibilities



Job Requirements"
https://ph.linkedin.com/jobs/view/front-end-web-developer-at-proweaver-ph-4300740822?position=8&pageNum=0&refId=yD2KGBXSvf8NrDXQIVZzYg%3D%3D&trackingId=lmYrGKrtbnqulstPH8Rr7g%3D%3D,Front-End Web Developer,Proweaver PH,Talisay,"A Front-End Web Developer will convert graphic designs into responsive web pages using HTML, CSS, and media queries while addressing client feedback to refine and enhance projects.









Additional Information



Qualified applicants will be contacted through text, call, or email by our Recruitment Team."
https://ph.linkedin.com/jobs/view/front-end-developer-i-web-application-integration-at-media-meter-inc-4267528604?position=9&pageNum=0&refId=yD2KGBXSvf8NrDXQIVZzYg%3D%3D&trackingId=SgMocmbU60%2Bvb65w3nfsGw%3D%3D,Front End Developer I Web & Application Integration,Media Meter Inc.,Quezon City,"About The Role

We're seeking a skilled Frontend Developer to build and maintain marketing websites while specializing in seamlessly integrating React applications into existing web properties. You'll work on creating engaging web experiences and embedding interactive tools, widgets, and applications across our digital ecosystem.





















You're someone who enjoys both crafting beautiful websites and solving complex integration challenges. You understand that not every solution needs to be a full SPA, and you're skilled at choosing the right tool for the job - whether that's a simple static site or a complex React application embedded within it."
https://ph.linkedin.com/jobs/view/part-time-frontend-developer-work-from-home-at-sozoroad-4312927244?position=10&pageNum=0&refId=yD2KGBXSvf8NrDXQIVZzYg%3D%3D&trackingId=Dq0Vr0tETJzxVF0coNpBBw%3D%3D,Part-Time Frontend Developer (Work From Home),Sozoroad,Davao,"This is a remote position.

Who We Are

At Sozoroad, we are a dynamic consulting and technology partner dedicated to assisting small and mid-sized businesses, nonprofit organizations, and local government entities in navigating change and fostering growth through innovation. Our team brings extensive expertise in digital strategy, operations, and emerging technologies—delivering practical solutions that make a tangible impact. We understand the unique challenges of our clients because we collaborate closely, listen attentively, and adapt swiftly. Our mission is clear: to empower organizations to address today's challenges and build for tomorrow—with smarter systems, sharper strategies, and a human touch. We think big, act boldly, and are laying the groundwork to become a leading force in our industry.



As a Part-Time Frontend Developer, you will be responsible for implementing and maintaining high-quality user interfaces across digital platforms. You’ll transform visual concepts and wireframes into responsive, accessible, and performance-optimized code. Your work will directly impact how users engage with the company's tools, services, and content.







You are a skilled front-end developer with a strong command of modern web technologies and a passion for building clean, efficient, and user-friendly interfaces. While you understand the importance of good design, your focus lies in implementation, performance, and functionality. You thrive in collaborative environments and enjoy turning concepts into code.

If you're a driven developer looking to contribute to an innovative, mission-driven company, we encourage you to apply.



This role follows a . Selected candidates will become part of Sozoroad’s talent pool and will be depending on project needs.









All qualified applicants will receive consideration for employment without regard to race, color, religion, sex, sexual orientation, gender identity, national origin, disability, or veteran status. We are also committed to providing reasonable accommodations to individuals with disabilities throughout the hiring process.

We believe the strongest teams are built on a wide range of life experiences, ideas, and perspectives. We welcome applicants from all walks of life who are passionate about making an impact.

Learn more about us at sozoroad.com/about ."
https://ph.linkedin.com/jobs/view/full-stack-web-developer-part-time-freelance-remote-at-magic-4317821531?position=11&pageNum=0&refId=yD2KGBXSvf8NrDXQIVZzYg%3D%3D&trackingId=sgNUN6p7HVxpdlHTlzr3sg%3D%3D,"Full-Stack Web Developer (part-time) - Freelance, Remote",Magic,Taguig,"Department: Support & Leadership
Location: Philippines
Compensation: $6.00 / hour




A U.S.-based leader in home inspector training, certification, and business enablement is building a modern, AI-enabled web platform to elevate inspection quality and efficiency. They help aspiring and practicing inspectors launch and grow their businesses with flexible courses, exam prep, and ongoing support. The team is now investing in software that streamlines inspections, ensures compliance, and seamlessly connects issues found to qualified contractors.


The client needs a custom student portal that integrates tightly with GoHighLevel, enabling students to manage schedules, attendance, payments, cancellations, and policy waivers in one place. This role exists to translate the vision into a secure, scalable, and user-friendly SaaS front end while leveraging GHL as the operational backbone. The hire will lead the initial project build with the potential for ongoing enhancements post-launch."
https://ph.linkedin.com/jobs/view/web-front-end-developer-work-from-home-at-quantrics-enterprises-inc-4308793757?position=12&pageNum=0&refId=yD2KGBXSvf8NrDXQIVZzYg%3D%3D&trackingId=LD8V%2B9OQ42sphAvsmRmwWQ%3D%3D,Web Front-End Developer (Work From Home),Quantrics Enterprises Inc.,Manila,"Specific Duties And Responsibilities

Execute basic content changes to the Bell.Ca website including modifying text, adding links, updating images and banners, maintaining product and services listed in an online catalogue."
https://ph.linkedin.com/jobs/view/frontend-developer-reactjs-at-white-cloak-technologies-inc-4314271587?position=13&pageNum=0&refId=yD2KGBXSvf8NrDXQIVZzYg%3D%3D&trackingId=rrS7IfsEiuJo49VeHVDVtA%3D%3D,Frontend Developer (ReactJS),"White Cloak Technologies, Inc.",Pasig,"Job Description:

We are looking for a Frontend Developer ReactJS who will be responsible for building, optimizing, and maintaining responsive web interfaces. The ideal candidate will have strong skills in JavaScript and ReactJS, with an eye for detail, design consistency, and user experience. You will collaborate closely with designers, backend developers, and product managers to deliver high-quality web applications that align with business goals and technical standards."
