url,title,company,location,description
https://ph.linkedin.com/jobs/view/digital-product-data-analyst-at-shopee-3918086367?position=11&pageNum=0&refId=5tZstpmWiywXvA%2FuQh2oJg%3D%3D&trackingId=RX4bsei4NcWyCp0130WzhQ%3D%3D,Digital Product - Data Analyst,Shopee,Manila,"Job Description

Works with digital product category leads and Business Unit (BU) Head in designing and developing reports and dashboards which will guide the organization in its decision making"
https://ph.linkedin.com/jobs/view/sql-data-analyst-%E2%80%93-remote-at-growthassistant-4310480739?position=12&pageNum=0&refId=5tZstpmWiywXvA%2FuQh2oJg%3D%3D&trackingId=2qWQ7MAnI7zMjTjYC0GYew%3D%3D,SQL Data Analyst – Remote,GrowthAssistant,Philippines,
https://ph.linkedin.com/jobs/view/business-data-analyst-at-bank-of-the-philippine-islands-bpi-4293886803?position=13&pageNum=0&refId=5tZstpmWiywXvA%2FuQh2oJg%3D%3D&trackingId=Q0QUJqq2eHOQQppdbDTF6A%3D%3D,BUSINESS DATA ANALYST,Bank of the Philippine Islands (BPI),Manila,"The Business Data Analyst is responsible for designing and maintaining data infrastructure, ensuring high-quality, secure, and accurate data for business intelligence. They optimize data flows, collaborate with cross-functional teams, and ensure compliance with regulations. The role involves managing end-to-end data projects, aligning systems with business needs, and continuously monitoring data quality and security."
https://ph.linkedin.com/jobs/view/junior-data-analyst-at-manpower-philippines-4305418110?position=14&pageNum=0&refId=5tZstpmWiywXvA%2FuQh2oJg%3D%3D&trackingId=Dz0rjDr%2FFD5lOO%2BiBzGaXg%3D%3D,Junior Data Analyst,Manpower (Philippines),Parañaque,"Key Responsibilities:
Review, understand and extract contract information from executed customer contracts accurately and efficiently."
https://ph.linkedin.com/jobs/view/data-analyst-at-emerson-4299088374?position=15&pageNum=0&refId=5tZstpmWiywXvA%2FuQh2oJg%3D%3D&trackingId=HPSJWlGLq8IJVWK1bEDIgQ%3D%3D,Data Analyst,Emerson,Mandaluyong,
https://ph.linkedin.com/jobs/view/data-analyst-at-lg-electronics-philippines-4314334722?position=16&pageNum=0&refId=5tZstpmWiywXvA%2FuQh2oJg%3D%3D&trackingId=s9%2FkVExWgw8VL7sdYtYUqg%3D%3D,Data Analyst,LG Electronics Philippines,Pasig,"Employment Type: Full-time/Permanent
Location: Full On-site
Department: Customer Care and Service
Service Planning Part Leader"
https://ph.linkedin.com/jobs/view/data-analyst-at-cognizant-4311275659?position=17&pageNum=0&refId=5tZstpmWiywXvA%2FuQh2oJg%3D%3D&trackingId=uRLQy%2Bbse519%2FEi9aSzt0g%3D%3D,Data Analyst,Cognizant,Metro Manila,"The Global Operations team is dedicated to driving productivity and efficiency across
the sales organization. We partner closely with sales teams and other departments across
to deliver key initiatives. Operating within the Global Sales, Strategy & Operations
organization—at the forefront of revenue growth—we design, build, and maintain"
https://ph.linkedin.com/jobs/view/shopee-choice-marketing-data-analysis-at-shopee-4215162055?position=18&pageNum=0&refId=5tZstpmWiywXvA%2FuQh2oJg%3D%3D&trackingId=JKlP5SFKhFUjQBh5cutmzQ%3D%3D,Shopee Choice Marketing - Data Analysis,Shopee,Manila,"About The Team

Shopee Choice is one of Shopee’s fastest-growing programs, offering users a curated selection of products at great value, with fast delivery and excellent service. By combining quality assurance with a seamless shopping experience, Shopee Choice continues to enhance user satisfaction and strengthen Shopee’s ecosystem. Join our team and contribute to impactful initiatives across strategy, analytics, marketing, and operations."
https://ph.linkedin.com/jobs/view/data-analyst-x-f-m-at-sellerx-4294057867?position=19&pageNum=0&refId=5tZstpmWiywXvA%2FuQh2oJg%3D%3D&trackingId=1m8BaWo12XLsXzbVwU3diw%3D%3D,Data Analyst (x/f/m),SellerX,Metro Manila,
https://ph.linkedin.com/jobs/view/data-analyst-at-netskope-4185847781?position=20&pageNum=0&refId=5tZstpmWiywXvA%2FuQh2oJg%3D%3D&trackingId=RPXIIIeihFEb9AGagCTBqw%3D%3D,Data Analyst,Netskope,Taguig,
https://ph.linkedin.com/jobs/view/reporting-analytics-shopee-supermarket-scommerce-at-shopee-4316942086?position=21&pageNum=0&refId=5tZstpmWiywXvA%2FuQh2oJg%3D%3D&trackingId=eqccDKlmL8kmY%2FXpQNnffQ%3D%3D,"Reporting & Analytics - Shopee Supermarket, Scommerce",Shopee,Manila,"About The Team

Shopee Supermarket is Shopee’s in-house retail channel offering a wide selection of grocery and household essentials from top FMCG suppliers. As a trusted one-stop shop for everyday needs, we ensure competitive pricing, reliable fulfillment, and curated deals to provide users with a seamless and value-driven online grocery experience. Join our team and contribute to impactful initiatives across strategy, analytics, marketing, and operations.



The Reporting & Analytics PIC will be critical in enabling data-driven decisions by managing performance dashboards, consolidating data sources, and ensuring accurate business monitoring. The role includes pulling data and making queries through SQL to support deeper analysis and actionable insights. Hiring this role ensures the team has clear visibility of results and the analytical foundation needed to drive sustainable growth for Shopee Supermarket’s retail business."
https://ph.linkedin.com/jobs/view/data-analyst-at-manpower-philippines-4316445450?position=22&pageNum=0&refId=5tZstpmWiywXvA%2FuQh2oJg%3D%3D&trackingId=4iq3%2BZ%2B31JLwLPw9CWzsuA%3D%3D,Data Analyst,Manpower (Philippines),Parañaque,"Essential Duties and Responsibilities:

Perform data collection (via data loads), including mapping, quality checks and business rules validation for reporting."
https://ph.linkedin.com/jobs/view/junior-data-analyst-at-media-meter-inc-4244079282?position=23&pageNum=0&refId=5tZstpmWiywXvA%2FuQh2oJg%3D%3D&trackingId=dwoHv%2BP0LylgSKKqKllapw%3D%3D,Junior Data Analyst,Media Meter Inc.,Quezon City,"As a Junior Data Analyst, you will play a crucial role in the data preprocessing phase of our project to fine-tune the Whisper model for Taglish and other languages. Your responsibilities will include collecting, organizing, cleaning, and preparing high-quality multilingual data for model training. You will work closely with the machine learning team to ensure that the data meets the necessary standards for effective model training.

































Minimum Qualifications:"
https://ph.linkedin.com/jobs/view/data-analyst-at-payreto-4057605240?position=24&pageNum=0&refId=5tZstpmWiywXvA%2FuQh2oJg%3D%3D&trackingId=HqMNigr85oktRBm%2FjnfNOg%3D%3D,Data Analyst,Payreto,Makati,"What We Offer

Competitive Salary Packages




The ideal candidate should have a flexible and agile mindset as he will be confronted with a lot of topics within Payreto. He / She needs to have innate curiosity and display ability, and passion to learn complex ideas and various tools / systems to pull data from and create meaningful insights and reports either for Payreto or its clients.

Despite being an entry level position, the candidate will be expected to display ownership of work and build reports from scratch and analyze big data of clients. The opportunity is for candidates who would like to gain exposure and experience with creating insights or analytics for different units within Payreto and for financial services clients of Payreto outside of the Philippines."
https://ph.linkedin.com/jobs/view/data-analyst-associate-at-alveo-land-4315897216?position=25&pageNum=0&refId=5tZstpmWiywXvA%2FuQh2oJg%3D%3D&trackingId=H1j8LRq3X0nlPL6BVAvKSw%3D%3D,Data Analyst Associate,Alveo Land,Taguig,"The Data Analyst Associate requires strong analytical skills, familiarity with process documentation, and basic coding/programming literacy. Exposure to data visualization tools is desired to effectively communicate insights and recommendations."
https://ph.linkedin.com/jobs/view/data-ai-associate-at-pwc-philippines-4316915476?position=26&pageNum=0&refId=5tZstpmWiywXvA%2FuQh2oJg%3D%3D&trackingId=dEBh3ilbFUcWXGj3ZF%2FMvQ%3D%3D,Data & AI Associate,PwC Philippines,Makati,"Job overview
We are looking for an entry-level Data & AI Associate to join our dynamic team. In this role, you will support the design and implementation of data and artificial intelligence initiatives across cloud platforms. You will help turn data into actionable insights, contribute to AI-driven innovation, and strengthen business operations through analytics and automation. This role offers an excellent foundation for growing into a future data and AI leader by gaining hands-on experience with business-focused AI strategies."
https://ph.linkedin.com/jobs/view/finance-data-analyst-ecl-at-maya-4303369741?position=27&pageNum=0&refId=5tZstpmWiywXvA%2FuQh2oJg%3D%3D&trackingId=NKwfYTwwVoZq7XvAWThlRQ%3D%3D,Finance Data Analyst (ECL),Maya,"National Capital Region, Philippines",
https://ph.linkedin.com/jobs/view/data-analyst-freelance-remote-at-magic-4251456808?position=28&pageNum=0&refId=5tZstpmWiywXvA%2FuQh2oJg%3D%3D&trackingId=LxrFEV40yC0FKyqQL%2BM8DQ%3D%3D,"Data Analyst - Freelance, Remote",Magic,Taguig,"Department: Support & Leadership
Location: Philippines
Compensation: $5.00 - $8.00 / hour




We're building an inclusive pool of Data Analysts across all experience levels and specializations to match with exciting client projects. Whether you're just starting your data analysis journey or you're a seasoned expert, we welcome your application. This is not a traditional job posting - instead, we're creating a talent pipeline to connect analysts with opportunities that match their expertise level and interests."
https://ph.linkedin.com/jobs/view/business-intelligence-analyst-at-unionbank-of-the-philippines-4307348221?position=29&pageNum=0&refId=5tZstpmWiywXvA%2FuQh2oJg%3D%3D&trackingId=%2B45OUUXI1bOLmHzKJ2Is6A%3D%3D,Business Intelligence Analyst,UnionBank of the Philippines,Pasig,"Job Description: Develops business intelligence dashboards, reports, MIS and provide data-driven insights to enable various groups in the bank to monitor their key metrics against goals, understand customer behavior, comply with regulatory and industry reporting requirements and make vital business decisions."
https://ph.linkedin.com/jobs/view/data-analyst-remote-at-sonic-electronix-4207138260?position=30&pageNum=0&refId=5tZstpmWiywXvA%2FuQh2oJg%3D%3D&trackingId=aTB9j1oFyTymoO4O3i92og%3D%3D,Data Analyst (Remote),Sonic Electronix,Metro Manila,"We are looking for a Data Analyst who will be responsible for developing, implementing, and optimizing programmatic advertising campaigns across multiple platforms.













$5–$7 per hour



You’ll get sweet discounts on all the audio and electronics your ears and wallet can handle, but the fun doesn’t stop there. A list of our perks include:






We use the gear we sell and love spreading audio bliss! We’re excited about our next chapter where we’re looking to revolutionize online shopping for audio in the car and on the go. We’re welcoming and excited to add super talented people to join this mission.

We’re a fun, energetic, successful dot-com with a great work environment and passion for audio. We have a casual dress code, plenty of products to geek out with, and growth in our future to get excited about."
https://ph.linkedin.com/jobs/view/business-data-analyst-at-general-motors-4313365549?position=31&pageNum=0&refId=5tZstpmWiywXvA%2FuQh2oJg%3D%3D&trackingId=J9q004hhh9XJYYX208PmOA%3D%3D,Business Data Analyst,General Motors,Taguig,"Job Description

Sponsorship: GM DOES NOT PROVIDE IMMIGRATION-RELATED SPONSORSHIP FOR THIS ROLE.  DO NOT APPLY FOR THIS ROLE IF YOU WILL NEED GM IMMIGRATION SPONSORSHIP (e.g., H-1B, TN, STEM OPT, etc.) NOW OR IN THE FUTURE.

This role is categorized as hybrid. This means the successful candidate is expected to report to GM Philippines office three times per week or other frequency dictated by the business.



The Transformation team within Global Business Solutions is passionate about driving a disruptive shift in strategy, structure, systems, processes, and technology across the enterprise. We strive to be global strategic business partners, delivering world class transformational solutions. We operate as a global organization, supporting various functions including Finance, Controllership, Purchasing, HR, Manufacturing, Sales, Marketing, and a growing list of new business partnerships.


















Our vision is a world with Zero Crashes, Zero Emissions and Zero Congestion and we embrace the responsibility to lead the change that will make our world better, safer and more equitable for all.



We believe we all must make a choice every day – individually and collectively – to drive meaningful change through our words, our deeds and our culture. Every day, we want every employee to feel they belong to one General Motors team.



General Motors is committed to being a workplace that is not only free of unlawful discrimination, but one that genuinely fosters inclusion and belonging. We strongly believe that providing an inclusive workplace creates an environment in which our employees can thrive and develop better products for our customers.

We encourage interested candidates to review the key responsibilities and qualifications for each role and apply for any positions that match their skills and capabilities. Applicants in the recruitment process may be required, where applicable, to successfully complete a role-related assessment(s) and/or a pre-employment screening prior to beginning employment. To learn more, visit .



General Motors offers opportunities to all job seekers including individuals with disabilities. If you need a reasonable accommodation to assist with your job search or application for employment, us or call us at 800-865-7580. In your email, please include a description of the specific accommodation you are requesting as well as the job title and requisition number of the position for which you are applying."
https://ph.linkedin.com/jobs/view/finance-data-analyst-at-jollibee-group-4312960830?position=32&pageNum=0&refId=5tZstpmWiywXvA%2FuQh2oJg%3D%3D&trackingId=kqbk1BSN%2BKF%2BPw9%2FNfBDfg%3D%3D,Finance Data Analyst,Jollibee Group,Pasig,
https://ph.linkedin.com/jobs/view/data-and-business-analyst-at-san-miguel-corporation-4315536512?position=33&pageNum=0&refId=5tZstpmWiywXvA%2FuQh2oJg%3D%3D&trackingId=pKVjmD2LNEYcsAUNMQRx0g%3D%3D,Data and Business Analyst,San Miguel Corporation,Mandaluyong,"Job Requirements:
At least a college graduate, preferably with a degree in STEM fields such as Engineering, Business Administration, or Information Technology."
https://ph.linkedin.com/jobs/view/portfolio-data-analyst-at-maya-4311870787?position=34&pageNum=0&refId=5tZstpmWiywXvA%2FuQh2oJg%3D%3D&trackingId=0M64q6q76DN4%2FmsoEEKZVA%3D%3D,Portfolio Data Analyst,Maya,Mandaluyong,
https://ph.linkedin.com/jobs/view/data-and-reporting-analyst-etl-expert-%E2%80%93-remote-at-growthassistant-4310502185?position=35&pageNum=0&refId=5tZstpmWiywXvA%2FuQh2oJg%3D%3D&trackingId=qlk9AMzbsuGrbPBuq1JzTA%3D%3D,Data and Reporting Analyst (ETL Expert) – Remote,GrowthAssistant,Philippines,
https://ph.linkedin.com/jobs/view/data-analyst-at-pioneer-insurance-4310318173?position=36&pageNum=0&refId=5tZstpmWiywXvA%2FuQh2oJg%3D%3D&trackingId=GL9o60hPvNuLK%2F3%2FVZUx%2BA%3D%3D,Data Analyst,Pioneer Insurance,Makati,
https://ph.linkedin.com/jobs/view/data-analytics-specialist-at-maya-4306092287?position=37&pageNum=0&refId=5tZstpmWiywXvA%2FuQh2oJg%3D%3D&trackingId=BTytdAV3sTRU5crdKZKxNw%3D%3D,Data Analytics Specialist,Maya,"National Capital Region, Philippines",
https://ph.linkedin.com/jobs/view/data-analyst-at-solar-philippines-4315664917?position=38&pageNum=0&refId=5tZstpmWiywXvA%2FuQh2oJg%3D%3D&trackingId=IZCaTnxtESv%2FHto7HDQ5%2Bg%3D%3D,Data Analyst,Solar Philippines,Makati,
https://ph.linkedin.com/jobs/view/junior-data-analyst-at-troveres-4312633067?position=39&pageNum=0&refId=5tZstpmWiywXvA%2FuQh2oJg%3D%3D&trackingId=mbpzDmagiUx2vDlC%2F7uSjw%3D%3D,Junior Data Analyst,Troveres,Philippines,"We are seeking a skilled Data Analyst to join our growing team and lead the evaluation and optimization of our Amazon advertising performance. This remote position offers an exciting opportunity to work at the intersection of e-commerce advertising, data science, and AI-powered insights."
https://ph.linkedin.com/jobs/view/data-analyst-at-strategic-staffing-solutions-4311782090?position=40&pageNum=0&refId=5tZstpmWiywXvA%2FuQh2oJg%3D%3D&trackingId=f3DbKcX%2FQIcsAF6ea%2Fw4mw%3D%3D,Data Analyst,Strategic Staffing Solutions,Makati,"Position: Data Analyst
📍 Location: Ayala, Makati City
🖥️ Work Setup: Hybrid (2 Days Onsite / 3 Days Remote)
🕘 Day Shift"
https://ph.linkedin.com/jobs/view/reporting-analyst-at-korn-ferry-4314242815?position=41&pageNum=0&refId=5tZstpmWiywXvA%2FuQh2oJg%3D%3D&trackingId=JX2lUD8eQlqlv1ZlKp7%2BSQ%3D%3D,Reporting Analyst,Korn Ferry,Taguig,"The Associate, Reporting role will employ data science methods to produce information, metrics and recruitment performance insights that demonstrate the value of a Korn Ferry engagement to advance a client’s strategic and tactical Talent Acquisition goals."
https://ph.linkedin.com/jobs/view/analyst-data-at-royal-caribbean-group-4308027154?position=42&pageNum=0&refId=5tZstpmWiywXvA%2FuQh2oJg%3D%3D&trackingId=QzX5253kHMdLiV2eSxeV9w%3D%3D,"Analyst, Data",Royal Caribbean Group,Pasay,"Journey with us! Combine your career goals and sense of adventure by joining our incredible team of employees at Royal Caribbean Group. We are proud to offer a competitive compensation and benefits package, and excellent career development opportunities, each offering unique ways to explore the world.

We are proud to be the vacation-industry leader with global brands — including Royal Caribbean International, Celebrity Cruises and Silversea Cruises — the most innovative fleet and private destinations, and the best people. Together, we are dedicated to turning the vacation of a lifetime into a lifetime of vacations for our guests.

Royal Caribbean Group’s Contact Center Analytics and Solutions Team has an exciting career opportunity for a full time Data Analyst reporting to the Sr. Manager, Contact Center Analytics Solutions.



The Contact Center Analytics & Solutions team is seeking a Data Analyst who will be responsible for delivering impactful insights into key business decisions and supporting projects/building tools that empower our end users to work efficiently. The right person for this role has exceptional analytical capabilities, thrives in a fast-paced environment, loves problem-solving, is a great communicator, and is passionate about our end user experience.













As you go through the application process, our recruiters will be glad to provide guidance, and more relevant details to answer any additional questions. Thank you again for your interest in Royal Caribbean Group. We'll hope to see you onboard soon!

It is the policy of the Company to ensure equal employment and promotion opportunity to qualified candidates without discrimination or harassment on the basis of race, color, religion, sex, age, national origin, disability, sexual orientation, sexuality, gender identity or expression, marital status, or any other characteristic protected by law. Royal Caribbean Group and each of its subsidiaries prohibit and will not tolerate discrimination or harassment."
https://ph.linkedin.com/jobs/view/reference-data-services-junior-analyst-at-citi-4105477857?position=43&pageNum=0&refId=5tZstpmWiywXvA%2FuQh2oJg%3D%3D&trackingId=6NzaoBV%2BP56QEeoXaPQhdg%3D%3D,Reference Data Services Junior Analyst,Citi,Taguig,"Whether you’re at the start of your career or looking to discover your next adventure, your story begins here. At Citi, you’ll have the opportunity to expand your skills and make a difference at one of the world’s most global banks. We’re fully committed to supporting your growth and development from the start with extensive on-the-job training and exposure to senior leaders, as well as more traditional learning. You’ll also have the chance to give back and make a positive impact where we live and work through volunteerism.



Citi’s enables Citi to achieve its day-to-day operational and long-term growth goals, enabling execution of Citi’s strategy by providing services, technical solutions and infrastructure across the bank.

We’re currently looking for a high caliber professional to join our team as (Internal Job Title: – ) based in BGC Taguig, Philippines. Being part of our team means that we’ll provide you with the resources to meet your unique needs, empower you to make healthy decision and manage your financial well-being to help plan for your future. For instance:



The Reference Data Services Analyst 1 is a trainee professional role. Requires a good knowledge of the range of processes, procedures and systems to be used in carrying out assigned tasks and a basic understanding of the underlying concepts and principles upon which the job is based. Good understanding of how the team interacts with others in accomplishing the objectives of the area. Makes evaluative judgements based on the analysis of factual information. They are expected to resolve problems by identifying and selecting solutions through the application of acquired technical experience and will be guided by precedents. Must be able to exchange information in a concise and logical way as well as be sensitive to audience diversity. Limited but direct impact on the business through the quality of the tasks/services provided. Impact of the job holder is restricted to own job.









Working at Citi is far more than just a job. A career with us means joining a family of more than 230,000 dedicated people from around the globe. At Citi, you’ll have the opportunity to grow your career, give back to your community and make a real impact.





This job description provides a high-level review of the types of work performed. Other job-related duties may be assigned as required.



------------------------------------------------------



Operations - Services

------------------------------------------------------



Reference Data Services

------------------------------------------------------



------------------------------------------------------



Please see the requirements listed above.

------------------------------------------------------



For complementary skills, please see above and/or contact the recruiter.

------------------------------------------------------"
https://ph.linkedin.com/jobs/view/data-analyst-at-pluxee-4299241976?position=44&pageNum=0&refId=5tZstpmWiywXvA%2FuQh2oJg%3D%3D&trackingId=Tvi9CUsumNlhms7s3AVPVw%3D%3D,Data Analyst,Pluxee,Manila,
https://ph.linkedin.com/jobs/view/business-intelligence-strategy-and-projects-at-shopee-4055959755?position=45&pageNum=0&refId=5tZstpmWiywXvA%2FuQh2oJg%3D%3D&trackingId=rxamz0VBTlc5qzHoX2XBVw%3D%3D,Business Intelligence - Strategy and Projects,Shopee,Manila,"Job Description

Contribute to Shopee’s growth objectives by improving users experience, optimizing spending/P&L and deriving required resources to achieve them;"
https://ph.linkedin.com/jobs/view/data-analytics-specialist-at-unilab-inc-4142989762?position=46&pageNum=0&refId=5tZstpmWiywXvA%2FuQh2oJg%3D%3D&trackingId=lcMEwJgV0MY9TMakZ9CW%2BQ%3D%3D,DATA ANALYTICS SPECIALIST,"Unilab, Inc.",Mandaluyong,
https://ph.linkedin.com/jobs/view/consumer-banking-group-mis-officer-at-bdo-unibank-4315088400?position=47&pageNum=0&refId=5tZstpmWiywXvA%2FuQh2oJg%3D%3D&trackingId=KB0ke8cwu4YTxc614RF6mw%3D%3D,Consumer Banking Group - MIS Officer,BDO Unibank,"National Capital Region, Philippines",
https://ph.linkedin.com/jobs/view/data-analyst-at-maxicare-healthcare-corporation-4206500491?position=48&pageNum=0&refId=5tZstpmWiywXvA%2FuQh2oJg%3D%3D&trackingId=IeM2Mchx9BoQE131M%2Fu60w%3D%3D,Data Analyst,Maxicare Healthcare Corporation,Makati,"Responsibilities

This position ensures that targets on cost, patient experience and patient outcomes for an assigned Business (i.e.In-patient, Outpatient, ER, Medical, Sales, Marketing and Operations, etc) are achieved. He/ She is responsible for monitoring actual performance against target by performing data analytics on lead, real time and lag performance indicators, variance analysis, and recommending or implementing interventions to deliver expected results.

The Successful Candidate Will Report To One Of The Utilization Management Leads Supporting Assigned Business Line And Will Work To Achieve The Following"
https://ph.linkedin.com/jobs/view/data-analyst-mid-at-angkas-4314621417?position=49&pageNum=0&refId=5tZstpmWiywXvA%2FuQh2oJg%3D%3D&trackingId=%2BdHW1wxkVy74sqHN6d9etQ%3D%3D,Data Analyst (Mid),Angkas,Makati,"About Us

We are a fast-growing ride-hailing company transforming urban transportation. Our mission is to make mobility safer, smarter, and more accessible through data-driven decisions. As we continue to scale, we're looking for a passionate and experienced Data Scientist to join our team and play a pivotal role in driving insights, innovation, and impact across the organization.



We are seeking a Mid Level Data Analyst who thrives on solving complex business challenges using data. In this role, you will collaborate cross-functionally with product, engineering, operations, and marketing teams to deliver actionable insights to enhance key business areas such as pricing, supply-demand matching, customer retention, and many more."
