url,title,company,location,description
https://ph.linkedin.com/jobs/view/front-end-developer-reactjs-marketing-commerce-product-ph-pdc-at-deloitte-4307831058?position=14&pageNum=0&refId=yD2KGBXSvf8NrDXQIVZzYg%3D%3D&trackingId=3WPJp8jKc6lj5yJjxeiadQ%3D%3D,"Front-End Developer (ReactJS) - Marketing, Commerce & Product - PH PDC",Deloitte,Metro Manila,"Title: Front-End Developer Consultant based in Deloitte Consulting Philippines Delivery Center



At Deloitte, our purpose is to make an impact that matters for our clients, our people, and the communities we serve.

We believe we have a responsibility to be a force for good, and WorldImpact is our portfolio of initiatives focused on making a tangible impact on society’s biggest challenges and creating a better future. We strive to advise clients on how to deliver purpose-led growth and embed more equitable, inclusive as well as sustainable business practices.

Hence, we seek talented individuals driven to excel and innovate, working together to achieve our shared goals.

We are committed to creating positive work experiences that foster a culture of respect and inclusion, where diverse perspectives are celebrated, and everyone is recognized for their contributions.





Deloitte helps organizations create great experiences, find their customers and audiences, and drive through to acquisition, retention, and loyalty. Become part of a team that brilliantly devices and implements solutions. Together with strategists, creative people and platform engineers, we create digital marketing and e-commerce capacity for our customers, enabling them to deliver the best customer experience.



At Deloitte, We Believe In The Importance Of Empowering Our People To Be Leaders At All Levels. We Connect Our Purpose And Shared Values To Identify Issues As Well As To Make An Impact That Matters To Our Clients, People And The Communities. Additionally, Consultants Across Our Firm Are Expected To















Sound like the sort of role for you? Apply now.

Due to volume of applications, we regret only shortlisted candidates will be notified.

Please note that Deloitte will never reach out to you directly via messaging platforms to offer you employment opportunities or request for money or your personal information. Kindly apply for roles that you are interested in via this official Deloitte website.

© 2025 DCPDC Inc."
https://ph.linkedin.com/jobs/view/frontend-engineer-at-elemnta-4222277052?position=15&pageNum=0&refId=yD2KGBXSvf8NrDXQIVZzYg%3D%3D&trackingId=I9OFZZQ0SxpPnTNEkOyA0g%3D%3D,Frontend Engineer,Elemnta,San Fernando,"Work from home and join a fast-growing Australian fintech company! We’re seeking an experienced Frontend Engineer who has a background with Web Development.





















We're shaping the future of financial services!

Initially driven by dissatisfaction with 'old-school' solutions and convoluted processes, we set out to revolutionize the financial advice industry. Utilizing our own proprietary technology, we've streamlined the back office of financial advice businesses, making life easier and more efficient for both financial advisors and their clients.

But that was just the beginning. Since our public launch in 2021, we've grown exponentially, expanding our vision to become more than just a digital fact-finding solution. Our integration platform now serves large financial services enterprises like investment platforms and life insurers, using custom middleware applications that enhance user experiences.

Fast forward to 2023, Elemnta was born to address industry challenges head-on. It's a product of the knowledge acquired by our advisors through overcoming various obstacles supported by our genuine experiences and the wisdom derived from the lessons learned along the way.

Our primary goal is to unleash your digital capabilities by facilitating connections, streamlining integrations, and catalyzing business transformation, all aimed at delivering a top-tier digital experience.

To learn more about our organization and the unique offerings we're developing, feel free to navigate to www.elemnta.com.

Apply today - the future is bright and we want you to be a part of it!"
https://ph.linkedin.com/jobs/view/front-end-developer-at-avaloq-4305577063?position=16&pageNum=0&refId=yD2KGBXSvf8NrDXQIVZzYg%3D%3D&trackingId=NnY5V9Yc0UO49cQcjovjfg%3D%3D,Front end Developer,Avaloq,Makati,"Company Description

Founded and headquartered in Switzerland, Avaloq is continuously expanding its global footprint with around 2,500 colleagues in 12 countries, and more than 170 clients in 35 countries. We are an industry-leading provider of wealth management technology and services for financial institutions around the world, including private banks and wealth managers, investment managers, as well as retail and neo banks. Our research led approach and continual innovation is powered by the passion and creativity of our colleagues.

We are always looking for talented people to join us on our mission to orchestrate the financial ecosystem and democratize access to wealth management. Avaloq offers the opportunity to work closely with some of the world’s leading financial institutions as we jointly develop and shape careers. Championing a collaborative, supportive and flexible work environment empowers our colleagues to reach their full potential.





Qualifications



Additional Information

We realize that managing work life balance is a challenge we all face in our daily lives and in order to support with this we are pleased to offer hybrid and flexible working for most of our Avaloqers to maintain work life balance and still continue our fantastic Avaloq culture in our global offices.

In Avaloq we are proud to embrace diversity and understand the success of our business is built on the power of different opinions, we are whole heartedly committed to fostering an equal opportunity environment and inclusive culture where you can be your true authentic self.

We hire, compensate and promote regardless of origin, age, gender identity, sexual orientation or any other fantastic traits that make us all unique, we have done our best to write this advert in an inclusive and neutral way.

Please be aware that we will not accept speculative CV submissions for any of our roles from recruitment agencies, and any unsolicited candidate submissions will be exempt from any payment expectations."
https://ph.linkedin.com/jobs/view/frontend-developer-at-technosphere-inc-4315882915?position=17&pageNum=0&refId=yD2KGBXSvf8NrDXQIVZzYg%3D%3D&trackingId=IIStKxDDcz8l1JvbyNAQoA%3D%3D,Frontend Developer,"TechnoSphere, Inc.",Philippines,"Role: Frontend Developer (React)
Experience: 8+ years
Location: Remote
100% Work-from-Home | Independent Contractor"
https://ph.linkedin.com/jobs/view/front-end-software-engineer-at-manulife-4258626321?position=18&pageNum=0&refId=yD2KGBXSvf8NrDXQIVZzYg%3D%3D&trackingId=Vd22mATclKMEOspnAMuqkg%3D%3D,Front End Software Engineer,Manulife,Makati,"We are seeking a talented and experienced Front End Software Engineer with expertise in Angular to join our dynamic engineering team. The ideal candidate will be responsible for designing, developing, and maintaining the front end of our web applications. You will work closely with cross-functional teams to deliver high-quality, scalable, and user-friendly interfaces. ?















Manulife Financial Corporation is a leading international financial services provider, helping people make their decisions easier and lives better. To learn more about us, visit https://www.manulife.com/en/about/our-story.html.



At Manulife/John Hancock, we embrace our diversity. We strive to attract, develop and retain a workforce that is as diverse as the customers we serve and to foster an inclusive work environment that embraces the strength of cultures and individuals. We are committed to fair recruitment, retention, advancement and compensation, and we administer all of our practices and programs without discrimination on the basis of race, ancestry, place of origin, colour, ethnic origin, citizenship, religion or religious beliefs, creed, sex (including pregnancy and pregnancy-related conditions), sexual orientation, genetic characteristics, veteran status, gender identity, gender expression, age, marital status, family status, disability, or any other ground protected by applicable law.

It is our priority to remove barriers to provide equal access to employment. A Human Resources representative will work with applicants who request a reasonable accommodation during the application process. All information shared during the accommodation request process will be stored and used in a manner that is consistent with applicable laws and Manulife/John Hancock policies. To request a reasonable accommodation in the application process, contact recruitment@manulife.com.



Hybrid"
https://ph.linkedin.com/jobs/view/frontend-engineer-react-at-tempo-yc-s23-4250268302?position=19&pageNum=0&refId=yD2KGBXSvf8NrDXQIVZzYg%3D%3D&trackingId=6oRtOUQfFPLI5ui6gv9F1Q%3D%3D,Frontend Engineer (React),Tempo (YC S23),Philippines,"Job Overview

As a Front-End Engineer at Tempo, you will play a pivotal role. Your focus will be on developing intuitive, high-performance web applications within our AI-powered visual IDE. You'll collaborate with a cross-functional team, contributing your technical expertise to create seamless experiences for designers and developers."
https://ph.linkedin.com/jobs/view/frontend-developer-at-100x-4308411047?position=20&pageNum=0&refId=yD2KGBXSvf8NrDXQIVZzYg%3D%3D&trackingId=WgOSLf%2Bo2dQpWA34OPom9w%3D%3D,Frontend Developer,100x,Philippines,"Position: Front-end Developer

Company: Distance

Full-time, Remote (EST Hours)



Distance is a powerful platform designed to help businesses enhance communication with their customers, streamline lead collection, and prioritize business opportunities. Distance combines software, AI agents, and personalized support to serve as the supercharged back-office for businesses. With an intuitive, user-friendly interface, Distance simplifies customer relationship management, making it easier for companies to focus on growth and achieving their revenue goals. Learn more at distance.so."
https://ph.linkedin.com/jobs/view/front-end-software-engineer-at-domaintools-4314854669?position=21&pageNum=0&refId=yD2KGBXSvf8NrDXQIVZzYg%3D%3D&trackingId=tM2eLq1aNyVkOHMlH6YfQQ%3D%3D,Front End Software Engineer,DomainTools,Philippines,"DomainTools is seeking a Software Engineer to join our Frontend Team. This position is perfect for someone interested in building powerful cybersecurity products and features for our enterprise customers. Our solutions help fuel mission critical efforts for customers including gathering threat intelligence, doing threat hunting, and performing online fraud investigation, and more."
https://ph.linkedin.com/jobs/view/frontend-developer-react-at-straive-4308908583?position=22&pageNum=0&refId=yD2KGBXSvf8NrDXQIVZzYg%3D%3D&trackingId=Qoemoya6sx%2Fv0JVo7TRh4g%3D%3D,Frontend Developer (React),Straive,Taguig,
https://ph.linkedin.com/jobs/view/junior-software-developer-web-mobile-application-at-trends-group-inc-4300561292?position=23&pageNum=0&refId=yD2KGBXSvf8NrDXQIVZzYg%3D%3D&trackingId=ROL%2Bv7tatdupjmkD7IHGBA%3D%3D,Junior Software Developer (Web & Mobile Application),Trends Group Inc.,Manila,"I. Duties And Responsibilities

System Design and Development:"
https://ph.linkedin.com/jobs/view/react-js-developer-at-xurpas-enterprise-4300906934?position=24&pageNum=0&refId=yD2KGBXSvf8NrDXQIVZzYg%3D%3D&trackingId=HCFVtz982tHok8z0n27hgg%3D%3D,React.js Developer,Xurpas Enterprise,Taguig,"Job Highlights

laptop to be provided

Role Summary

1









Technical Environment

Additional Information



Mid to Senior



Taguig City



100% Onsite



Project-based

APPLY NOW"
https://ph.linkedin.com/jobs/view/web-ui-developer-at-unison-group-4312997586?position=25&pageNum=0&refId=yD2KGBXSvf8NrDXQIVZzYg%3D%3D&trackingId=Ha8jwpsMzLkf%2BGxZUWafNA%3D%3D,Web UI Developer,Unison Group,Manila,"Develop and maintain web applications using ReactJS, JavaScript, and Node.js
Collaborate closely with back-end developers to implement seamless client-server API interactions on the Web UI"
https://ph.linkedin.com/jobs/view/web-developer-at-aclan-group-of-companies-4303940947?position=26&pageNum=0&refId=yD2KGBXSvf8NrDXQIVZzYg%3D%3D&trackingId=0kuR6HAVBznfb4WKlvYx3A%3D%3D,Web Developer,Aclan Group of Companies,Cavite,
https://ph.linkedin.com/jobs/view/front-end-developer-at-digiplus-interactive-corp-4312398967?position=27&pageNum=0&refId=yD2KGBXSvf8NrDXQIVZzYg%3D%3D&trackingId=zcS3rvFcvjbfVPvRWmyZpw%3D%3D,Front End Developer,DigiPlus Interactive Corp,Taguig,"About DigiPlus Interactive Corp.
DigiPlus Interactive Corp. pioneered digital entertainment in the Philippines. It introduced leading platforms BingoPlus and ArenaPlus, widely known for their engaging experiences in interactive gaming and sports entertainment. DigiPlus also operates GameZone, with more to come. For more information, visit: www.digiplus.com.ph."
https://ph.linkedin.com/jobs/view/front-end-web-engineer-at-codev-4306530108?position=28&pageNum=0&refId=yD2KGBXSvf8NrDXQIVZzYg%3D%3D&trackingId=ZTEZOJsyEnW6%2BKLPiQhPVg%3D%3D,Front End Web Engineer,CoDev,Philippines,"Work Arrangement: Work From Home
Work Location: WFH Philippines
Working Days: Mondays to Fridays if (Mid or Night Shift)"
https://ph.linkedin.com/jobs/view/web-developer-at-aclan-group-of-companies-4303943891?position=29&pageNum=0&refId=yD2KGBXSvf8NrDXQIVZzYg%3D%3D&trackingId=kpVE56SPTWzTEvaLYIDVNA%3D%3D,Web Developer,Aclan Group of Companies,Bacoor,
https://ph.linkedin.com/jobs/view/software-engineer-reactjs-developer-at-unionbank-of-the-philippines-4316435747?position=30&pageNum=0&refId=yD2KGBXSvf8NrDXQIVZzYg%3D%3D&trackingId=HFed0%2FnsRKrundbe2Bi4DQ%3D%3D,Software Engineer (ReactJS Developer),UnionBank of the Philippines,Pasig,
https://ph.linkedin.com/jobs/view/frontend-developer-at-weave-solutions-inc-4314498084?position=31&pageNum=0&refId=yD2KGBXSvf8NrDXQIVZzYg%3D%3D&trackingId=zRkVspvMwaKARLr4lhFiow%3D%3D,Frontend Developer,"Weave Solutions, Inc.",Makati,
https://ph.linkedin.com/jobs/view/web-developer-at-seo-hacker-4302842080?position=32&pageNum=0&refId=yD2KGBXSvf8NrDXQIVZzYg%3D%3D&trackingId=grrxJWX2hApcCzMxys82FA%3D%3D,Web Developer,SEO Hacker,Parañaque,"Develop custom WordPress themes from scratch, adhering to best practices and design standards.
Utilize Custom Post Types and Advanced Custom Fields (ACF) plugins to enhance the functionality and flexibility of WordPress websites."
https://ph.linkedin.com/jobs/view/junior-javascript-developer-at-tort-experts-4292342676?position=33&pageNum=0&refId=yD2KGBXSvf8NrDXQIVZzYg%3D%3D&trackingId=AVoJm6k7wUSn0FnZ3rXHbQ%3D%3D,Junior JavaScript Developer,Tort Experts,Balimbing,"About Tort Experts

At Tort Experts, we are redefining the landscape of performance marketing in the legal sector. Our mission is to democratize access to information for individuals who have been injured, connecting them with law firms that can truly advocate for their rights and achieve successful outcomes. As an innovative, vertically integrated legal case acquisition marketing company, we leverage cutting-edge technology, data-driven insights, and a commitment to transparency to disrupt the status quo.

Joining Tort Experts means becoming part of a dynamic team that is passionate about making a meaningful impact. We foster a collaborative environment where creativity thrives, and every team member plays a vital role in connecting qualified claimants with the representation they deserve. If you’re looking for a workplace where your contributions can truly make a difference, and where innovation meets purpose, Tort Experts is the perfect place for you.



We are looking for a versatile junior full stack developer, who has a love for JavaScript, to help across multiple business areas building tools to help team members accomplish their tasks more accurately and efficiently. Specifically you will build and maintain React components for our lead generation landing pages. Our websites are hosted by Vercel with Builder.io as the content management system of a WYSIWYG website builder. The candidate would have responsibility for administration and operation of the full web publishing system.

Additionally, we have a suite of internal applications built on the Retool platform. We are looking for someone to take the lead on developing and maintaining these applications.

Finally, there will be a need to write clean html, css, and standard JS for quick website fixes with on website forms. This is not a design job but you should be able to update code to match designs.

We have a small but very powerful and agile technology team that is building some amazing tools that help the company grow at a fast pace.














At Tort Experts, we believe in empowering our team members with growth opportunities, a flexible work environment, and the chance to make a tangible impact. If you thrive in fast-paced environments and are driven, client-focused, and eager to contribute to our mission of connecting clients with top-tier legal representation. Are you ready to lead the next wave of growth in legal marketing? Apply today and help us transform access to justice!

no-reply@ats.rippling.com.

We kindly ask that you . Due to the volume of submissions, we are unable to respond to individual application status requests.



Tort Experts provides equal employment opportunities to all employees and applicants for employment and prohibits discrimination and harassment of any type without regard to race, color, religion, age, sex, national origin, disability status, genetics, protected veteran status, sexual orientation, gender identity or expression, or any other characteristic protected by federal, state or local laws. This applies to all terms and conditions of employment."
https://ph.linkedin.com/jobs/view/frontend-developer-at-eclaro-4315573502?position=34&pageNum=0&refId=yD2KGBXSvf8NrDXQIVZzYg%3D%3D&trackingId=zzR0hcj8pEJTUqdyDNptdQ%3D%3D,Frontend Developer,ECLARO,Philippines,"Who We Are

ECLARO is an award-winning professional services firm headquartered in New York City and operating in the U.S., Philippines and Canada, additionally supporting clients in the UK, Ireland and Australia. We are dedicated to a singular purpose: providing the Right People with the right expertise, business knowledge, skill sets, dedication and passion to solve business challenges for global clients ranging from innovative start-ups to Fortune 50 companies. “Work Hard. Give Back. Have Fun.” is one of our favorite sayings, and we live it every day. Supporting employees and colleagues, serving clients and giving back to our communities"
https://ph.linkedin.com/jobs/view/web-developer-at-aclan-group-of-companies-4303954751?position=35&pageNum=0&refId=yD2KGBXSvf8NrDXQIVZzYg%3D%3D&trackingId=J0bNVFQ%2F5eS7nJ6rO94kTw%3D%3D,Web Developer,Aclan Group of Companies,Manila,
https://ph.linkedin.com/jobs/view/frontend-developer-at-eclaro-4316429824?position=36&pageNum=0&refId=yD2KGBXSvf8NrDXQIVZzYg%3D%3D&trackingId=bW%2Fje0LSGXVi5upc9ElqIg%3D%3D,Frontend Developer,ECLARO,Philippines,
https://ph.linkedin.com/jobs/view/software-engineer-javascript-at-white-cloak-technologies-inc-4312131770?position=37&pageNum=0&refId=yD2KGBXSvf8NrDXQIVZzYg%3D%3D&trackingId=Ct4xvyTQQ%2FMIlAGeUOMjoA%3D%3D,Software Engineer - Javascript,"White Cloak Technologies, Inc.",Quezon City,"Responsibilities

Develop, maintain, and enhance web applications using JavaScript and related technologies."
https://ph.linkedin.com/jobs/view/react-developer-at-neostella-4307500095?position=38&pageNum=0&refId=yD2KGBXSvf8NrDXQIVZzYg%3D%3D&trackingId=NGvSXoyZY%2BygrQtTaCXDNA%3D%3D,React Developer,Neostella,Cebu,"At Neostella, our mission is simple: empower legal teams to work smarter, faster, and more reliably. We deliver advanced technology solutions and satellite team support that streamline operations, boost efficiency, and transform the way firms and corporate legal departments work day to day. We're relentlessly customer-centric. Everything we do is in service of making our clients' work easier and helping them deliver better experiences to their clients. We're also a true team: supportive, scrappy, and always in it together. We believe in showing up for one another, rolling up our sleeves, and celebrating the wins. It's who we are, and it's how we help our customers succeed. Neostella is in hyper-growth mode, leveraging cutting-edge technology to solve real challenges for our clients. And we're looking for driven, people-first professionals to help us scale with purpose and heart. As we continue to expand, we are seeking a React Developer to join our team!

The ideal candidate will be responsible for designing, developing, testing, and debugging responsive web applications for the company. Using React Js, JavaScript, HTML, and CSS, this candidate will be able to translate user and business needs into functional frontend design. The growth potential and opportunities here are endless and we want you to be a part of our journey. Curious what your day would look like as a React Developer? Check out the details below!"
https://ph.linkedin.com/jobs/view/mid-frontend-developer-hybrid-set-up-at-iscale-solutions-4312164155?position=39&pageNum=0&refId=yD2KGBXSvf8NrDXQIVZzYg%3D%3D&trackingId=3PuYMl9f0OZXpmnA3wkj2w%3D%3D,Mid Frontend Developer (Hybrid set-up),iScale Solutions,Makati,"This is a remote position.
Building reusable code and libraries for future use.
Troubleshooting, Unit Testing, Manual Test Script.





Requirements



















Benefits

● Full Time Employment with competitive salary and benefits
● Medical, dental, and vision insurance coverage"
https://ph.linkedin.com/jobs/view/front-end-software-developer-at-egis-4294321175?position=40&pageNum=0&refId=yD2KGBXSvf8NrDXQIVZzYg%3D%3D&trackingId=T9bru4Nncr7fYayh9bPSeQ%3D%3D,Front-end Software Developer,Egis,Pasig,"Company Description

Egis is a leading global architectural, consulting, construction engineering, operations and mobility services firm. We create and operate intelligent infrastructure and buildings that both respond to the climate emergency and contribute to balanced, sustainable and resilient development. Our 20,500 employees operate across over 100 countries, deploying their expertise to develop and deliver cutting-edge innovations and solutions for clients. Through the wide range of our activities, we are central to the collective organisation of society and the living environment of citizens all over the world.

Egis Projects Philippines Inc (EPPI) provide services to private sector entities involved in the business of building, operating or managing roadways, railways, and other transportation infrastructure projects.



Responsible for developing and implementing highly-responsive user interface components for web and mobile applications. Ideal candidates must have strong proficiency in React, JavaScript, HTML, CSS, and have proven experience creating data visualization tools, monitoring user interactions, and optimizing components to work seamlessly across different browsers and devices. In order to fulfill this role, the candidate must also be an open-minded and creative team player. Good time management and project management skills are a must."
https://ph.linkedin.com/jobs/view/junior-web-developer-at-first-page-4307345708?position=41&pageNum=0&refId=yD2KGBXSvf8NrDXQIVZzYg%3D%3D&trackingId=xOuASxgk3Hyl%2Fh%2BgR7SKsg%3D%3D,Junior Web Developer,First Page,Philippines,
