url,title,company,location,description
https://ph.linkedin.com/jobs/view/front-end-software-engineer-at-domaintools-4314854669?position=21&pageNum=0&refId=S1bO8FLeUJZ07I1rrjG92A%3D%3D&trackingId=WjLEJT0ZUjcyAJ%2BN%2FVpLtQ%3D%3D,Front End Software Engineer,DomainTools,Philippines,"DomainTools is seeking a Software Engineer to join our Frontend Team. This position is perfect for someone interested in building powerful cybersecurity products and features for our enterprise customers. Our solutions help fuel mission critical efforts for customers including gathering threat intelligence, doing threat hunting, and performing online fraud investigation, and more."
https://ph.linkedin.com/jobs/view/frontend-developer-react-at-straive-4308908583?position=22&pageNum=0&refId=S1bO8FLeUJZ07I1rrjG92A%3D%3D&trackingId=YXJ8kRJ1atxLhSNKYl8b%2FA%3D%3D,Frontend Developer (React),Straive,Taguig,
https://ph.linkedin.com/jobs/view/junior-software-developer-web-mobile-application-at-trends-group-inc-4300561292?position=23&pageNum=0&refId=S1bO8FLeUJZ07I1rrjG92A%3D%3D&trackingId=MIzMlhwL%2FomOzqFjuUII8g%3D%3D,Junior Software Developer (Web & Mobile Application),Trends Group Inc.,Manila,"I. Duties And Responsibilities

System Design and Development:"
https://ph.linkedin.com/jobs/view/react-js-developer-at-xurpas-enterprise-4300906934?position=24&pageNum=0&refId=S1bO8FLeUJZ07I1rrjG92A%3D%3D&trackingId=jInBUGpJ%2BnZ%2BY0Hi4cgKFg%3D%3D,React.js Developer,Xurpas Enterprise,Taguig,"Job Highlights

laptop to be provided

Role Summary

1









Technical Environment

Additional Information



Mid to Senior



Taguig City



100% Onsite



Project-based

APPLY NOW"
https://ph.linkedin.com/jobs/view/web-ui-developer-at-unison-group-4312997586?position=25&pageNum=0&refId=S1bO8FLeUJZ07I1rrjG92A%3D%3D&trackingId=UuKIeIZmkcaWYTlkOVKpdw%3D%3D,Web UI Developer,Unison Group,Manila,"Develop and maintain web applications using ReactJS, JavaScript, and Node.js
Collaborate closely with back-end developers to implement seamless client-server API interactions on the Web UI"
https://ph.linkedin.com/jobs/view/web-developer-at-aclan-group-of-companies-4303940947?position=26&pageNum=0&refId=S1bO8FLeUJZ07I1rrjG92A%3D%3D&trackingId=b9PDr%2F%2FZntT5XvSAiaB%2Bhw%3D%3D,Web Developer,Aclan Group of Companies,Cavite,
https://ph.linkedin.com/jobs/view/front-end-developer-at-digiplus-interactive-corp-4312398967?position=27&pageNum=0&refId=S1bO8FLeUJZ07I1rrjG92A%3D%3D&trackingId=hRrrLafPa6zxGNrkcBBtqQ%3D%3D,Front End Developer,DigiPlus Interactive Corp,Taguig,"About DigiPlus Interactive Corp.
DigiPlus Interactive Corp. pioneered digital entertainment in the Philippines. It introduced leading platforms BingoPlus and ArenaPlus, widely known for their engaging experiences in interactive gaming and sports entertainment. DigiPlus also operates GameZone, with more to come. For more information, visit: www.digiplus.com.ph."
https://ph.linkedin.com/jobs/view/front-end-web-engineer-at-codev-4306530108?position=28&pageNum=0&refId=S1bO8FLeUJZ07I1rrjG92A%3D%3D&trackingId=3fhgio0iqV5%2BnoVlyjl24g%3D%3D,Front End Web Engineer,CoDev,Philippines,"Work Arrangement: Work From Home
Work Location: WFH Philippines
Working Days: Mondays to Fridays if (Mid or Night Shift)"
https://ph.linkedin.com/jobs/view/web-developer-at-aclan-group-of-companies-4303943891?position=29&pageNum=0&refId=S1bO8FLeUJZ07I1rrjG92A%3D%3D&trackingId=uVcALGFypZXG%2BfhEztw0MA%3D%3D,Web Developer,Aclan Group of Companies,Bacoor,
https://ph.linkedin.com/jobs/view/software-engineer-reactjs-developer-at-unionbank-of-the-philippines-4316435747?position=30&pageNum=0&refId=S1bO8FLeUJZ07I1rrjG92A%3D%3D&trackingId=uQHef8gLuykQl0Ckh3wigw%3D%3D,Software Engineer (ReactJS Developer),UnionBank of the Philippines,Pasig,
https://ph.linkedin.com/jobs/view/frontend-developer-at-weave-solutions-inc-4314498084?position=31&pageNum=0&refId=S1bO8FLeUJZ07I1rrjG92A%3D%3D&trackingId=00gO0cp%2Bq0itR6x27HNJ7Q%3D%3D,Frontend Developer,"Weave Solutions, Inc.",Makati,
https://ph.linkedin.com/jobs/view/web-developer-at-seo-hacker-4302842080?position=32&pageNum=0&refId=S1bO8FLeUJZ07I1rrjG92A%3D%3D&trackingId=gvo8IiEDJ%2FkAvLClmFjSOA%3D%3D,Web Developer,SEO Hacker,Parañaque,"Develop custom WordPress themes from scratch, adhering to best practices and design standards.
Utilize Custom Post Types and Advanced Custom Fields (ACF) plugins to enhance the functionality and flexibility of WordPress websites."
https://ph.linkedin.com/jobs/view/junior-javascript-developer-at-tort-experts-4292342676?position=33&pageNum=0&refId=S1bO8FLeUJZ07I1rrjG92A%3D%3D&trackingId=%2Bej7BYWmDyhNP0aI6MTOjA%3D%3D,Junior JavaScript Developer,Tort Experts,Balimbing,"About Tort Experts

At Tort Experts, we are redefining the landscape of performance marketing in the legal sector. Our mission is to democratize access to information for individuals who have been injured, connecting them with law firms that can truly advocate for their rights and achieve successful outcomes. As an innovative, vertically integrated legal case acquisition marketing company, we leverage cutting-edge technology, data-driven insights, and a commitment to transparency to disrupt the status quo.

Joining Tort Experts means becoming part of a dynamic team that is passionate about making a meaningful impact. We foster a collaborative environment where creativity thrives, and every team member plays a vital role in connecting qualified claimants with the representation they deserve. If you’re looking for a workplace where your contributions can truly make a difference, and where innovation meets purpose, Tort Experts is the perfect place for you.



We are looking for a versatile junior full stack developer, who has a love for JavaScript, to help across multiple business areas building tools to help team members accomplish their tasks more accurately and efficiently. Specifically you will build and maintain React components for our lead generation landing pages. Our websites are hosted by Vercel with Builder.io as the content management system of a WYSIWYG website builder. The candidate would have responsibility for administration and operation of the full web publishing system.

Additionally, we have a suite of internal applications built on the Retool platform. We are looking for someone to take the lead on developing and maintaining these applications.

Finally, there will be a need to write clean html, css, and standard JS for quick website fixes with on website forms. This is not a design job but you should be able to update code to match designs.

We have a small but very powerful and agile technology team that is building some amazing tools that help the company grow at a fast pace.














At Tort Experts, we believe in empowering our team members with growth opportunities, a flexible work environment, and the chance to make a tangible impact. If you thrive in fast-paced environments and are driven, client-focused, and eager to contribute to our mission of connecting clients with top-tier legal representation. Are you ready to lead the next wave of growth in legal marketing? Apply today and help us transform access to justice!

no-reply@ats.rippling.com.

We kindly ask that you . Due to the volume of submissions, we are unable to respond to individual application status requests.



Tort Experts provides equal employment opportunities to all employees and applicants for employment and prohibits discrimination and harassment of any type without regard to race, color, religion, age, sex, national origin, disability status, genetics, protected veteran status, sexual orientation, gender identity or expression, or any other characteristic protected by federal, state or local laws. This applies to all terms and conditions of employment."
https://ph.linkedin.com/jobs/view/frontend-developer-at-eclaro-4315573502?position=34&pageNum=0&refId=S1bO8FLeUJZ07I1rrjG92A%3D%3D&trackingId=bn8eG5hxtygP0P8u%2Fr6fZA%3D%3D,Frontend Developer,ECLARO,Philippines,"Who We Are

ECLARO is an award-winning professional services firm headquartered in New York City and operating in the U.S., Philippines and Canada, additionally supporting clients in the UK, Ireland and Australia. We are dedicated to a singular purpose: providing the Right People with the right expertise, business knowledge, skill sets, dedication and passion to solve business challenges for global clients ranging from innovative start-ups to Fortune 50 companies. “Work Hard. Give Back. Have Fun.” is one of our favorite sayings, and we live it every day. Supporting employees and colleagues, serving clients and giving back to our communities"
https://ph.linkedin.com/jobs/view/web-developer-at-aclan-group-of-companies-4303954751?position=35&pageNum=0&refId=S1bO8FLeUJZ07I1rrjG92A%3D%3D&trackingId=yaKoeRenIKMX5QwMP4NoqQ%3D%3D,Web Developer,Aclan Group of Companies,Manila,
https://ph.linkedin.com/jobs/view/frontend-developer-at-eclaro-4316429824?position=36&pageNum=0&refId=S1bO8FLeUJZ07I1rrjG92A%3D%3D&trackingId=peHLi%2F1b%2BMtnlhmrMaPOBg%3D%3D,Frontend Developer,ECLARO,Philippines,
https://ph.linkedin.com/jobs/view/software-engineer-javascript-at-white-cloak-technologies-inc-4312131770?position=37&pageNum=0&refId=S1bO8FLeUJZ07I1rrjG92A%3D%3D&trackingId=EnNTuzEGKR0hSBFChbN%2BFw%3D%3D,Software Engineer - Javascript,"White Cloak Technologies, Inc.",Quezon City,"Responsibilities

Develop, maintain, and enhance web applications using JavaScript and related technologies."
https://ph.linkedin.com/jobs/view/react-developer-at-neostella-4307500095?position=38&pageNum=0&refId=S1bO8FLeUJZ07I1rrjG92A%3D%3D&trackingId=cPLszcjx2n3HOPmGlNV0nw%3D%3D,React Developer,Neostella,Cebu,"At Neostella, our mission is simple: empower legal teams to work smarter, faster, and more reliably. We deliver advanced technology solutions and satellite team support that streamline operations, boost efficiency, and transform the way firms and corporate legal departments work day to day. We're relentlessly customer-centric. Everything we do is in service of making our clients' work easier and helping them deliver better experiences to their clients. We're also a true team: supportive, scrappy, and always in it together. We believe in showing up for one another, rolling up our sleeves, and celebrating the wins. It's who we are, and it's how we help our customers succeed. Neostella is in hyper-growth mode, leveraging cutting-edge technology to solve real challenges for our clients. And we're looking for driven, people-first professionals to help us scale with purpose and heart. As we continue to expand, we are seeking a React Developer to join our team!

The ideal candidate will be responsible for designing, developing, testing, and debugging responsive web applications for the company. Using React Js, JavaScript, HTML, and CSS, this candidate will be able to translate user and business needs into functional frontend design. The growth potential and opportunities here are endless and we want you to be a part of our journey. Curious what your day would look like as a React Developer? Check out the details below!"
https://ph.linkedin.com/jobs/view/mid-frontend-developer-hybrid-set-up-at-iscale-solutions-4312164155?position=39&pageNum=0&refId=S1bO8FLeUJZ07I1rrjG92A%3D%3D&trackingId=oflkMAdho3hAgGAdQX2vnw%3D%3D,Mid Frontend Developer (Hybrid set-up),iScale Solutions,Makati,"This is a remote position.
Building reusable code and libraries for future use.
Troubleshooting, Unit Testing, Manual Test Script.





Requirements



















Benefits

● Full Time Employment with competitive salary and benefits
● Medical, dental, and vision insurance coverage"
https://ph.linkedin.com/jobs/view/front-end-software-developer-at-egis-4294321175?position=40&pageNum=0&refId=S1bO8FLeUJZ07I1rrjG92A%3D%3D&trackingId=rOR8%2BTM8axag7PBd2d0arA%3D%3D,Front-end Software Developer,Egis,Pasig,"Company Description

Egis is a leading global architectural, consulting, construction engineering, operations and mobility services firm. We create and operate intelligent infrastructure and buildings that both respond to the climate emergency and contribute to balanced, sustainable and resilient development. Our 20,500 employees operate across over 100 countries, deploying their expertise to develop and deliver cutting-edge innovations and solutions for clients. Through the wide range of our activities, we are central to the collective organisation of society and the living environment of citizens all over the world.

Egis Projects Philippines Inc (EPPI) provide services to private sector entities involved in the business of building, operating or managing roadways, railways, and other transportation infrastructure projects.



Responsible for developing and implementing highly-responsive user interface components for web and mobile applications. Ideal candidates must have strong proficiency in React, JavaScript, HTML, CSS, and have proven experience creating data visualization tools, monitoring user interactions, and optimizing components to work seamlessly across different browsers and devices. In order to fulfill this role, the candidate must also be an open-minded and creative team player. Good time management and project management skills are a must."
https://ph.linkedin.com/jobs/view/junior-web-developer-at-first-page-4307345708?position=41&pageNum=0&refId=S1bO8FLeUJZ07I1rrjG92A%3D%3D&trackingId=9QlxDtAHPJrCoQntT9Zfbw%3D%3D,Junior Web Developer,First Page,Philippines,
https://ph.linkedin.com/jobs/view/website-developer-at-mci-4229521430?position=42&pageNum=0&refId=S1bO8FLeUJZ07I1rrjG92A%3D%3D&trackingId=fVUltG1l7L3xv1Cck9sYBA%3D%3D,Website Developer,MCI,Angeles,"Angeles City, PH

Full-Time

MCI is one of the fastest-growing tech-enabled business services companies in the USA, with a strong call center footprint and operations that extend across multiple countries. We deliver Customer Experience (CX), Business Process Outsourcing (BPO), and Anything-as-a-Service (XaaS) cloud technology solutions across a wide range of industries, including healthcare, retail, government, education, telecom, technology e-commerce, and financial services. Our contact centers are powered by both on-site and remote agents, leveraging advanced technologies to enhance customer journeys, drive scalability and reduce costs.

At MCI we are committed to fostering an environment where professionals can build meaningful careers, access continuous learning and development opportunities and contribute to the success of a globally expanding, industry-leading organization.

We are seeking a to join our team. As a Website Developer, you will be at the forefront of crafting engaging and user-friendly digital experiences that captivate audiences and drive business growth. Your expertise in web development technologies, coding languages, and design principles will empower you to create dynamic websites and web applications that meet client requirements and exceed user expectations.










All positive, and driven applicants are encouraged to apply. The Ideal candidates for this position are highly motivated and dedicated and should possess the below qualities
















At MCI, your hard work deserves recognition and rewards. Our compensation and benefits packages are designed to be competitive and to grow with you over time. Starting compensation is based on experience, and we offer a variety of benefits and incentives to support and reward our team members.



We understand the importance of balance and support, which is why we offer a variety of benefits and incentives that go beyond a paycheck. Our team members enjoy




Rank & File ₱100,000 coverage

Supervisors/Managers ₱120,000 coverage




In-house dental assistance worth ₱5,000, giving you easier access to quality care






MCI takes pride in tailoring our offerings to fit the needs of our diverse team across subsidiaries and locations. While specific benefits and incentives may vary by geography, the core of our commitment remains the same rewarding effort, providing growth opportunities, and creating an environment where every employee feels valued.

If you’re ready to join a company that recognizes your contributions and supports your growth, MCI is the place for you. Apply today!

This job operates in a professional office environment. While performing the duties of this job, the employee will be largely sedentary and will be required to sit/stand for long periods while using a computer and telephone headset. The employee will be regularly required to operate a computer and other office equipment, including a phone, copier, and printer. The employee may occasionally be required to move about the office to accomplish tasks; reach in any direction; raise or lower objects, move objects from place to place, hold onto objects, and move or exert force up to forty (40) pounds.

Consistent with the Americans with Disabilities Act (ADA), it is the policy of MCI and its affiliates to provide reasonable accommodations when requested by a qualified applicant or employee with a disability unless such accommodations would cause undue hardship. The policy regarding requests for reasonable accommodation applies to all aspects of employment. If reasonable accommodations are needed, please contact Human Resources.







MCI helps customers take on their CX and DX challenges differently, creating industry-leading solutions that deliver exceptional experiences and drive optimal performance. MCI assists companies with business process outsourcing, staff augmentation, contact center customer services, and IT Services needs by providing general and specialized hosting, software, staff, and services.

In 2019, Marlowe Companies Inc. (MCI) was named by Inc. Magazine as Iowa's Fastest Growing Company in the State of Iowa and was named the 452nd Fastest Growing Privately Company in the USA, making the coveted top 500 for the first time. MCI's subsidiaries had previously made Inc. Magazine's List of Fastest-Growing Companies 15 times, respectively. MCI has ten business process outsourcing service delivery facilities in Georgia, Florida, Texas, New Mexico, California, Kansas, Nova Scotia, South Africa, and the Philippines.

Driving modernization through digitalization, MCI ensures clients do more for less. MCI is the holding company for a diverse lineup of tech-enabled business services operating companies. MCI organically grows, acquires, and operates companies that have synergistic products and services portfolios, including but not limited to Automated Contact Center Solutions (ACCS), customer contact management, IT Services (IT Schedule 70), and Temporary and Administrative Professional Staffing (TAPS Schedule 736), Business Process Management (BPM), Business Process Outsourcing (BPO), Claims Processing, Collections, Customer Experience Provider (CXP), Customer Service, Digital Experience Provider (DXP), Account Receivables Management (ARM), Application Software Development, Managed Services, and Technology Services, to mid-market, Federal & enterprise partners. MCI now employs 10,000+ talented individuals with 150+ diverse North American client partners across the following MCI brands MCI BPO, MCI BPOaaS, MarketForce, GravisApps, Gravis Marketing, MarchEast, Mass Markets, MCI Federal Services (MFS), OnBrand24, The Sydney Call Center, Valor Intelligent Processing (VIP), BYC Aqua, EastWest BPO, TeleTechnology, and Vinculum.

The purpose of the above job description is to provide potential candidates with a general overview of the role. It's not an all-inclusive list of the duties, responsibilities, skills, and qualifications required for the job. You may be asked by your supervisors or managers to perform other duties. You will be evaluated in part based on your performance of the tasks listed in this job description.

The employer has the right to revise this job description at any time. This job description is not an employment contract, and either you or the employer may terminate employment at any time for any reason."
https://ph.linkedin.com/jobs/view/front-end-developer-at-smartsourcing-4317537154?position=43&pageNum=0&refId=S1bO8FLeUJZ07I1rrjG92A%3D%3D&trackingId=yZnsyrGQiNHp%2F7b5rFGzhQ%3D%3D,,,,
https://ph.linkedin.com/jobs/view/angular-developer-chandigarh-at-cyzerg-4157861034?position=44&pageNum=0&refId=S1bO8FLeUJZ07I1rrjG92A%3D%3D&trackingId=5%2BVFYCDze17E34Svy5YVBw%3D%3D,Angular Developer - Chandigarh,Cyzerg,Metro Davao,"About The Company

Cyzerg is a technology company specialized in the research, development, implementation and management of technology solutions for the warehousing industry. With over 148 active customers across North, Central and South America, Cyzerg has developed industry expertise and capabilities to increase business efficiency and competitiveness across its customer base.

With headquarters in Miami, FL and branches in the Philippines and India, the company credits its success to a relentless focus on its employees, customers, and delivering excellence at all times. Anchored on a culture of meritocracy and on the pillars of opportunity, integrity, innovation, humanity, passion, teamwork & opportunity, Cyzergs culture & core values guide every aspect of the organization.



We are looking for a talented and detail-oriented Angular Developer to be part of our web application development team. Primary responsibilities will be front-end development of web applications using Angular 6 , Ajax, and RESTful web services. He/she will be responsible for implementing visual elements and their behaviors with user interactions. You will work with front-end and back-end developers, QA analysts, and product managers. The ideal candidate should be a self-driven professional, always curious about new front-end technologies and perfecting the user experience.















Chandigarh, Punjab"
https://ph.linkedin.com/jobs/view/react-js-developer-at-dxc-technology-4291558382?position=45&pageNum=0&refId=S1bO8FLeUJZ07I1rrjG92A%3D%3D&trackingId=kN2StLkmac74v9hZzVP%2BBQ%3D%3D,React.JS Developer,DXC Technology,Manila,
https://ph.linkedin.com/jobs/view/web-app-developer-at-remoteva-4308950227?position=46&pageNum=0&refId=S1bO8FLeUJZ07I1rrjG92A%3D%3D&trackingId=6pr5tNBLEif6iv0hdTZWXg%3D%3D,Web & App Developer,RemoteVA,Philippines,"RemoteVA PH is seeking a skilled Web & App Developer to join our dynamic team. The ideal candidate will have a strong background in UI/UX design for websites and experience in mobile application development. You will be responsible for creating visually appealing and user-friendly websites and mobile applications that meet our clients' needs.

Key Responsibilities:





Qualifications:





Working Schedule



send your CV and portfolio to: mondilla.jay03@gmail.com"
https://ph.linkedin.com/jobs/view/web-developer-at-outsourced-doers-4302702630?position=47&pageNum=0&refId=S1bO8FLeUJZ07I1rrjG92A%3D%3D&trackingId=zztyqiMjt1mjgXkcteyYKQ%3D%3D,Web Developer,Outsourced Doers,Philippines,
https://ph.linkedin.com/jobs/view/web-developer-at-marie-france-group-of-companies-4304866881?position=48&pageNum=0&refId=S1bO8FLeUJZ07I1rrjG92A%3D%3D&trackingId=fJ6TsvkDaEfo%2BIaLrvmkBg%3D%3D,Web Developer,Marie France Group of Companies,Makati,"We are seeking a Full Stack Web Developer to join our IT Department. The successful candidate will play a key role in building and maintaining web and mobile applications, supporting automation workflows, and assisting in system integrations. This position will work under the guidance of the Technical Lead and in collaboration with the Business Analyst and QA team to ensure the delivery of reliable and scalable solutions."
https://ph.linkedin.com/jobs/view/web-app-developer-at-remoteva-4308940341?position=49&pageNum=0&refId=S1bO8FLeUJZ07I1rrjG92A%3D%3D&trackingId=tcqDFsujJOjv4qXFh03FyA%3D%3D,Web & App Developer,RemoteVA,Philippines,"RemoteVA PH is seeking a skilled Web & App Developer to join our dynamic team. The ideal candidate will have a strong background in UI/UX design for websites and experience in mobile application development. You will be responsible for creating visually appealing and user-friendly websites and mobile applications that meet our clients' needs.

Key Responsibilities:





Qualifications:





Working Schedule



send your CV and portfolio to: mondilla.jay03@gmail.com"
https://ph.linkedin.com/jobs/view/front-end-developer-mid-level-at-avaloq-4304500672?position=50&pageNum=0&refId=S1bO8FLeUJZ07I1rrjG92A%3D%3D&trackingId=WJj%2BVqOq6wR5BfxCxBnOww%3D%3D,Front End Developer (Mid level),Avaloq,Makati,
https://ph.linkedin.com/jobs/view/javascript-developer-reactjs-at-socium-teams-done-differently-4314362565?position=51&pageNum=0&refId=S1bO8FLeUJZ07I1rrjG92A%3D%3D&trackingId=VQvSHp%2FiC20m4OnGoRj0Qw%3D%3D,Javascript Developer (ReactJS),Socium - Teams Done Differently,Makati,
